"id_vacunados_covid19","id_persona","fecha_vacunacion","dosis","edad","sexo","ubigeo_persona","id_gruporiesgo","grupo_riesgo","id_vacuna","fabricante","fabricante_pais","id_eess","eess","eess_diresa","eess_categoria","eess_ubigeo","id_centro_vacunacion","centro_vacunacion","centro_vacunacion_entidad_admin","centro_vacunacion_ubigeo","rango_edad","rango_edad_deciles","rango_edad_quintiles","rango_edad_owid","epi_week","epi_year"
4510654,5132356,2021-02-08,2,52,"F","150115",17,"Personal de Salud",6,"SINOPHARM","CHN",18653,"CENTRO DE ESTUDIOS CLÍNICOS UPCH","LIMA DIRIS NORTE","I-2","150135",0,"MISMO ESTABLECIMIENTO DE SALUD","MINSA","150135","40-59","50-59","50-54","50-59",6,2021
8343233,3663856,2021-02-08,1,52,"M","120214",62,"Personas de 50 a 59 años",6,"SINOPHARM","CHN",12014,"CHAQUICOCHA","JUNIN","I-2","120214",0,"MISMO ESTABLECIMIENTO DE SALUD","MINSA","120214","40-59","50-59","50-54","50-59",6,2021
8646041,4607427,2021-02-08,1,53,"M","150133",11,"Personal Militar ó FF AA",5,"PFIZER","USA",18555,"HOSPITAL  MILITAR LUIS ARIAS SCHEREIBER","LIMA DIRIS CENTRO","III-1","150113",0,"MISMO ESTABLECIMIENTO DE SALUD","MINSA","150113","40-59","50-59","50-54","50-59",6,2021
19500081,20390468,2021-02-08,1,58,"M","021602",62,"Personas de 50 a 59 años",6,"SINOPHARM","CHN",5230,"MEXICO","LIMA DIRIS NORTE","I-4","150135",34,"Gran Unidad Escolar Jose Granda","MINSA","150135","40-59","50-59","55-59","50-59",6,2021
24271848,22497895,2021-02-08,1,37,"F","150106",68,"Personas de 30 a 39 años",6,"SINOPHARM","CHN",17306,"CENTRO MATERNO INFANTIL LAURA RODRIGUEZ DULANTO DUKSIL","LIMA DIRIS NORTE","I-4","150110",752,"Parque Zonal Sinchi Roca","MINSA","150110","20-39","30-39","35-39","25-49",6,2021
41183499,22740963,2021-02-08,2,27,"M","150110",17,"Personal de Salud",6,"SINOPHARM","CHN",18653,"CENTRO DE ESTUDIOS CLÍNICOS UPCH","LIMA DIRIS NORTE","I-2","150135",0,"MISMO ESTABLECIMIENTO DE SALUD","MINSA","150135","20-39","20-29","25-29","25-49",6,2021
48721359,4938371,2021-02-08,1,55,"M","160403",62,"Personas de 50 a 59 años",6,"SINOPHARM","CHN",4306,"ISLANDIA DEL YAVARI","LORETO","I-3","160403",0,"MISMO ESTABLECIMIENTO DE SALUD","MINSA","160403","40-59","50-59","55-59","50-59",6,2021
50265865,38369024,2021-02-08,1,26,NA,NA,71,"Personas de 20  a 29 años",6,"SINOPHARM","CHN",24541,"CLAS AGUAS VERDES","TUMBES","I-3","240302",0,"MISMO ESTABLECIMIENTO DE SALUD","MINSA","240302","20-39","20-29","25-29","25-49",6,2021
